### ISSUE TITLE
mqttsrv command not working?

### ISSUE THREAD

**Issue by bitvijays** [fablabbcn/smartcitizen-kit-21#26]
Dear SCK Team, 

Hope you are doing well. Thank you for the support. We are trying to set up custom mqtt server and port number using `mqttsrv` command. However, it seems the change is not happening. We built the SAM and ESP firmware. Is there any other way to test this?

#### Version
```
SCK > version
Hardware Version: 2.1
SAM Hardware ID: 6D8DAA9850515157382E3120FF0E3111
SAM version: 0.9.7-d42ed80
SAM build date: 2021-07-31T13:40:50Z
ESP MAC address: CE:50:E3:18:FD:A1
ESP version: 0.9.2-8b3c4e0
ESP build date: 2021-07-31T12:55:40Z
```

#### mqttsrv settings

```
SCK > mqttsrv
Mqtt Host: 80.X.X.X
Mqtt Port: 80
```

#### Wireshark logs of the router

```
13:43:00.266207 IP 0.0.0.0.68 > 255.255.255.255.67: BOOTP/DHCP, Request from cc:50:e3:18:fd:a1 (oui Unknown), length 308
13:43:00.266305 IP 0.0.0.0.68 > 255.255.255.255.67: BOOTP/DHCP, Request from cc:50:e3:18:fd:a1 (oui Unknown), length 308
13:43:00.268537 IP 192.168.1.89.67 > 192.168.1.216.68: BOOTP/DHCP, Reply, length 300
13:43:00.279314 IP 0.0.0.0.68 > 255.255.255.255.67: BOOTP/DHCP, Request from cc:50:e3:18:fd:a1 (oui Unknown), length 308
13:43:00.279382 IP 0.0.0.0.68 > 255.255.255.255.67: BOOTP/DHCP, Request from cc:50:e3:18:fd:a1 (oui Unknown), length 308
13:43:00.290614 IP 192.168.1.89.67 > 192.168.1.216.68: BOOTP/DHCP, Reply, length 300
13:43:00.301148 IP li714-156.members.linode.com.80 > 192.168.1.216.50194: Flags [F.], seq 2809240972, ack 6857, win 30016, length 0
13:43:00.319096 IP 192.168.1.216.50194 > li714-156.members.linode.com.80: Flags [R.], seq 1, ack 1, win 24584, length 0
13:43:00.320506 IP 192.168.1.216.50194 > li714-156.members.linode.com.80: Flags [R.], seq 1, ack 1, win 24584, length 0
13:43:00.610542 IP 192.168.1.216.50112 > 192.168.1.89.53: 1+ A? mqtt.smartcitizen.me. (38)
13:43:00.613040 IP 192.168.1.89.53 > 192.168.1.216.50112: 1 1/0/0 A 85.159.210.156 (54)
13:43:00.615652 IP 192.168.1.216.60010 > li714-156.members.linode.com.80: Flags [S], seq 6509, win 2144, options [mss 536,nop,nop,sackOK], length 0
13:43:00.626018 IP li714-156.members.linode.com.80 > 192.168.1.216.60010: Flags [S.], seq 1623811755, ack 6510, win 29200, options [mss 1452,nop,nop,sackOK], length 0
13:43:00.628046 IP 192.168.1.216.60010 > li714-156.members.linode.com.80: Flags [.], ack 1, win 2144, length 0
13:43:00.628801 IP 192.168.1.216.60010 > li714-156.members.linode.com.80: Flags [P.], seq 1:21, ack 1, win 2144, length 20: HTTP
13:43:00.639063 IP li714-156.members.linode.com.80 > 192.168.1.216.60010: Flags [.], ack 21, win 29200, length 0
13:43:00.639274 IP li714-156.members.linode.com.80 > 192.168.1.216.60010: Flags [P.], seq 1:5, ack 21, win 29200, length 4: HTTP
13:43:00.701385 IP 192.168.1.216.60010 > li714-156.members.linode.com.80: Flags [P.], seq 21:348, ack 5, win 2140, length 327: HTTP
13:43:00.753277 IP li714-156.members.linode.com.80 > 192.168.1.216.60010: Flags [.], ack 348, win 30016, length 0
13:43:02.813851 IP 192.168.1.226.5353 > 224.0.0.251.5353: 0 [2q] [1au] PTR (QU)? _companion-link._tcp.local. PTR (QU)? _homekit._tcp.local. (88)
13:43:02.868620 IP 192.168.1.254 > all-systems.mcast.net: igmp query v3
13:43:03.325828 IP6 fe80::1c42:cef1:1fa9:c0bd > ff02::fb: HBH ICMP6, multicast listener donemax resp delay: 0 addr: ff02::fb, length 24
13:43:03.819739 IP 192.168.1.226.5353 > 224.0.0.251.5353: 0 [2q] [1au] PTR (QM)? _companion-link._tcp.local. PTR (QM)? _homekit._tcp.local. (88)
13:43:10.651899 IP 0.0.0.0.68 > 255.255.255.255.67: BOOTP/DHCP, Request from b8:27:eb:ea:b4:9a (oui Unknown), length 290
13:43:25.151251 IP6 fe80::5eb1:3eff:fe13:fb71 > ip6-allnodes: ICMP6, router advertisement, length 144
```

**Comment by vicobarberan** [comment]
Closing it since `mqttsrv` command was implemented on Nov 30 2020 in [this](https://github.com/fablabbcn/smartcitizen-kit-21/commit/6175bbd36a58396ddd0e23f6d506b8e68ee52d1d) commit and your ESP firmware version is [8b3c4e0](https://github.com/fablabbcn/smartcitizen-kit-21/commit/8b3c4e0ebe135d26514e7ccd9afb37c2f8fc70b5) from Sep 3 2020. A simple firmware [update](https://docs.smartcitizen.me/Guides/firmware/Update%20the%20firmware/) will fix this.
